{
 "$schema": "model_cache.schema.json",
 "json": {
  "consensus": "The pundits agree that the crucial moment involves how Bastian Sandoval handles the ball following a high turnover against the defensive block.",
  "dissent": "The sharpest disagreement is whether Bastian Sandoval should immediately take the shot or recycle possession with an extra pass.",
  "headline": "Sandoval Decision: Shoot Early or Keep the Ball"
 },
 "record": "model_result",
 "round": 5,
 "schema_version": "1.0.0",
 "text": "{\"consensus\":\"The pundits agree that the crucial moment involves how Bastian Sandoval handles the ball following a high turnover against the defensive block.\",\"dissent\":\"The sharpest disagreement is whether Bastian Sandoval should immediately take the shot or recycle possession with an extra pass.\",\"headline\":\"Sandoval Decision: Shoot Early or Keep the Ball\"}",
 "verified": null,
 "via": "live"
}
