{
 "$schema": "model_cache.schema.json",
 "json": {
  "claims": [],
  "stance": "disagree",
  "take": "When you catch them in transition, Tobi Okafor has to pull the trigger immediately before the press resets, rather than slowing the break down."
 },
 "record": "model_result",
 "round": 2,
 "schema_version": "1.0.0",
 "text": "{\"take\": \"When you catch them in transition, Tobi Okafor has to pull the trigger immediately before the press resets, rather than slowing the break down.\", \"stance\": \"disagree\", \"claims\": []}",
 "verified": null,
 "via": "live"
}
