{
 "$schema": "model_cache.schema.json",
 "json": {
  "body": "Choosing the pass option changes the success rate to 60%.",
  "claims": [
   "60%"
  ],
  "headline": "Clearance vs Pass Debate"
 },
 "record": "model_result",
 "round": 6,
 "schema_version": "1.0.0",
 "text": "{\"headline\": \"Clearance vs Pass Debate\", \"body\": \"Choosing the pass option changes the success rate to 60%.\", \"claims\": [\"60%\"]}",
 "verified": true,
 "via": "live"
}
