{
 "$schema": "model_cache.schema.json",
 "json": {
  "claims": [
   {
    "evidence_ids": [
     "pc_044528"
    ],
    "kind": "tactical",
    "text": "3v0 central overload in the middle third",
    "unit": "",
    "value_text": "overload_centre_middle_third"
   },
   {
    "evidence_ids": [
     "pc_044528"
    ],
    "kind": "number",
    "text": "24%",
    "unit": "percent",
    "value_number": 0.2367
   },
   {
    "evidence_ids": [
     "cf_000064"
    ],
    "kind": "number",
    "text": "7%",
    "unit": "xt",
    "value_number": 0.07122
   },
   {
    "evidence_ids": [
     "cf_000064"
    ],
    "kind": "number",
    "text": "2%",
    "unit": "xt",
    "value_number": 0.01626
   }
  ],
  "stance": "agree",
  "take": "You don't need to rush a transition when your structure gives you a 3v0 central overload in the middle third and the hosts only control 24% of the pitch. Playing the alternative option consolidates territory and lifts expected threat to 7% compared to just 2% on the hurried pass, keeping the away side in total command of the phase."
 },
 "record": "model_result",
 "round": 3,
 "schema_version": "1.0.0",
 "text": "{\"take\": \"You don't need to rush a transition when your structure gives you a 3v0 central overload in the middle third and the hosts only control 24% of the pitch. Playing the alternative option consolidates territory and lifts expected threat to 7% compared to just 2% on the hurried pass, keeping the away side in total command of the phase.\", \"stance\": \"agree\", \"claims\": [{\"text\": \"3v0 central overload in the middle third\", \"kind\": \"tactical\", \"value_text\": \"overload_centre_middle_third\", \"unit\": \"\", \"evidence_ids\": [\"pc_044528\"]}, {\"text\": \"24%\", \"kind\": \"number\", \"value_number\": 0.2367, \"unit\": \"percent\", \"evidence_ids\": [\"pc_044528\"]}, {\"text\": \"7%\", \"kind\": \"number\", \"value_number\": 0.07122, \"unit\": \"xt\", \"evidence_ids\": [\"cf_000064\"]}, {\"text\": \"2%\", \"kind\": \"number\", \"value_number\": 0.01626, \"unit\": \"xt\", \"evidence_ids\": [\"cf_000064\"]}]}",
 "verified": null,
 "via": "live"
}
