{
 "$schema": "model_cache.schema.json",
 "json": {
  "body": "Ironvale exploit a 5v1 overload in the central middle third. Okafor, Sandoval, Penhallow, and Grabowski control the space.",
  "claims": [
   "Ironvale",
   "5v1 overload in the central middle third",
   "Okafor",
   "Sandoval",
   "Penhallow",
   "Grabowski"
  ],
  "headline": "Ironvale Create Central Advantage"
 },
 "record": "model_result",
 "round": 4,
 "schema_version": "1.0.0",
 "text": "{\"headline\": \"Ironvale Create Central Advantage\", \"body\": \"Ironvale exploit a 5v1 overload in the central middle third. Okafor, Sandoval, Penhallow, and Grabowski control the space.\", \"claims\": [\"Ironvale\", \"5v1 overload in the central middle third\", \"Okafor\", \"Sandoval\", \"Penhallow\", \"Grabowski\"]}",
 "verified": true,
 "via": "live"
}
