{
 "$schema": "model_cache.schema.json",
 "json": {
  "alternatives": [
   {
    "actor": "p_020",
    "kind": "pass",
    "reason": "Square the ball to Tolliver for a cleaner central finishing opportunity.",
    "target": "p_021"
   },
   {
    "actor": "p_020",
    "kind": "pass",
    "reason": "Switch play across the penalty box to find Bolingbroke in space.",
    "target": "p_023"
   }
  ]
 },
 "record": "model_result",
 "round": 1,
 "schema_version": "1.0.0",
 "text": "{\"alternatives\": [{\"kind\": \"pass\", \"actor\": \"p_020\", \"target\": \"p_021\", \"reason\": \"Square the ball to Tolliver for a cleaner central finishing opportunity.\"}, {\"kind\": \"pass\", \"actor\": \"p_020\", \"target\": \"p_023\", \"reason\": \"Switch play across the penalty box to find Bolingbroke in space.\"}]}",
 "verified": null,
 "via": "live"
}
