{
 "$schema": "model_cache.schema.json",
 "json": {
  "claims": [],
  "stance": "agree",
  "take": "Wendel Sandoval kills the transition by holding onto the ball when the opposition press is disorganized, giving them critical seconds to recover their defensive shape. You have to release the ball immediately after winning it back to exploit that space before the trap closes."
 },
 "record": "model_result",
 "round": 2,
 "schema_version": "1.0.0",
 "text": "{\"take\": \"Wendel Sandoval kills the transition by holding onto the ball when the opposition press is disorganized, giving them critical seconds to recover their defensive shape. You have to release the ball immediately after winning it back to exploit that space before the trap closes.\", \"stance\": \"agree\", \"claims\": []}",
 "verified": null,
 "via": "live"
}
