{
 "$schema": "model_cache.schema.json",
 "json": {
  "body": "Dimitriou sets up Novacek for a Verdant opportunity rated at 0.42 xG.",
  "claims": [
   "Dimitriou",
   "Novacek",
   "Verdant",
   "0.42 xG"
  ],
  "headline": "Dimitriou creates a major chance for Verdant"
 },
 "record": "model_result",
 "round": 1,
 "schema_version": "1.0.0",
 "text": "{\"headline\": \"Dimitriou creates a major chance for Verdant\", \"body\": \"Dimitriou sets up Novacek for a Verdant opportunity rated at 0.42 xG.\", \"claims\": [\"Dimitriou\", \"Novacek\", \"Verdant\", \"0.42 xG\"]}",
 "verified": true,
 "via": "live"
}
