{
 "$schema": "model_cache.schema.json",
 "json": {
  "claims": [
   {
    "evidence_ids": [
     "pc_025117"
    ],
    "kind": "tactical",
    "text": "3v1 overload on the right of the middle third",
    "unit": "",
    "value_text": "overload_right_middle_third"
   },
   {
    "evidence_ids": [
     "pc_025117"
    ],
    "kind": "number",
    "text": "12%",
    "unit": "percent",
    "value_number": 0.1214
   },
   {
    "evidence_ids": [
     "cf_000052"
    ],
    "kind": "number",
    "text": "1 point",
    "unit": "win_prob_delta",
    "value_number": -0.0069
   }
  ],
  "stance": "agree",
  "take": "Beyond just transition momentum, the away side owns the structure here with a 3v1 overload on the right of the middle third while restricting the hosts to 12% of that zone. Carrying the ball maintains that territorial grip and pushes the home win probability down by 1 point instead of gifting possession back with a rushed strike."
 },
 "record": "model_result",
 "round": 3,
 "schema_version": "1.0.0",
 "text": "{\"take\": \"Beyond just transition momentum, the away side owns the structure here with a 3v1 overload on the right of the middle third while restricting the hosts to 12% of that zone. Carrying the ball maintains that territorial grip and pushes the home win probability down by 1 point instead of gifting possession back with a rushed strike.\", \"stance\": \"agree\", \"claims\": [{\"text\": \"3v1 overload on the right of the middle third\", \"kind\": \"tactical\", \"value_text\": \"overload_right_middle_third\", \"unit\": \"\", \"evidence_ids\": [\"pc_025117\"]}, {\"text\": \"12%\", \"kind\": \"number\", \"value_number\": 0.1214, \"unit\": \"percent\", \"evidence_ids\": [\"pc_025117\"]}, {\"text\": \"1 point\", \"kind\": \"number\", \"value_number\": -0.0069, \"unit\": \"win_prob_delta\", \"evidence_ids\": [\"cf_000052\"]}]}",
 "verified": null,
 "via": "live"
}
