{
 "$schema": "model_cache.schema.json",
 "json": {
  "claims": [],
  "stance": "disagree",
  "take": "When you force a turnover high up the pitch, Bastian Sandoval has to pull the trigger immediately before the defensive block can recover and reset its shape."
 },
 "record": "model_result",
 "round": 2,
 "schema_version": "1.0.0",
 "text": "{\"take\": \"When you force a turnover high up the pitch, Bastian Sandoval has to pull the trigger immediately before the defensive block can recover and reset its shape.\", \"stance\": \"disagree\", \"claims\": []}",
 "verified": null,
 "via": "live"
}
