{
 "$schema": "model_cache.schema.json",
 "json": {
  "alternatives": [
   {
    "actor": "p_046",
    "kind": "pass",
    "reason": "Spread the play out wide to maintain attacking momentum in the final third.",
    "target": "p_045"
   },
   {
    "actor": "p_046",
    "kind": "pass",
    "reason": "Switch the attack across to the opposite wing to exploit open space.",
    "target": "p_047"
   },
   {
    "actor": "p_046",
    "kind": "carry",
    "reason": "Drive directly forward into central space to commit opposing defenders.",
    "target": "e"
   }
  ]
 },
 "record": "model_result",
 "round": 1,
 "schema_version": "1.0.0",
 "text": "{\n  \"alternatives\": [\n    {\n      \"kind\": \"pass\",\n      \"actor\": \"p_046\",\n      \"target\": \"p_045\",\n      \"reason\": \"Spread the play out wide to maintain attacking momentum in the final third.\"\n    },\n    {\n      \"kind\": \"pass\",\n      \"actor\": \"p_046\",\n      \"target\": \"p_047\",\n      \"reason\": \"Switch the attack across to the opposite wing to exploit open space.\"\n    },\n    {\n      \"kind\": \"carry\",\n      \"actor\": \"p_046\",\n      \"target\": \"e\",\n      \"reason\": \"Drive directly forward into central space to commit opposing defenders.\"\n    }\n  ]\n}",
 "verified": null,
 "via": "live"
}
