{
 "$schema": "model_cache.schema.json",
 "json": {
  "alternatives": [
   {
    "actor": "p_023",
    "kind": "carry",
    "reason": "Drive into the open space ahead to draw opponents out of shape.",
    "target": "e"
   },
   {
    "actor": "p_023",
    "kind": "pass",
    "reason": "Switch play more directly into the path of an advanced attacker.",
    "target": "p_021"
   },
   {
    "actor": "p_023",
    "kind": "pass",
    "reason": "Find a central midfield option to maintain possession and build steadily.",
    "target": "p_013"
   }
  ]
 },
 "record": "model_result",
 "round": 1,
 "schema_version": "1.0.0",
 "text": "{\"alternatives\": [{\"kind\": \"carry\", \"actor\": \"p_023\", \"target\": \"e\", \"reason\": \"Drive into the open space ahead to draw opponents out of shape.\"}, {\"kind\": \"pass\", \"actor\": \"p_023\", \"target\": \"p_021\", \"reason\": \"Switch play more directly into the path of an advanced attacker.\"}, {\"kind\": \"pass\", \"actor\": \"p_023\", \"target\": \"p_013\", \"reason\": \"Find a central midfield option to maintain possession and build steadily.\"}]}",
 "verified": null,
 "via": "live"
}
