{
 "$schema": "model_cache.schema.json",
 "json": {
  "body": "In the 84th minute, Tolliver and Dimitriou face off in a moment carrying a 2% chance of a goal and a shift of 2 points.",
  "claims": [
   "84th minute",
   "Tolliver",
   "Dimitriou",
   "2%",
   "2 points"
  ],
  "headline": "Tolliver and Dimitriou clash late"
 },
 "record": "model_result",
 "round": 7,
 "schema_version": "1.0.0",
 "text": "{\"headline\":\"Tolliver and Dimitriou clash late\",\"body\":\"In the 84th minute, Tolliver and Dimitriou face off in a moment carrying a 2% chance of a goal and a shift of 2 points.\",\"claims\":[\"84th minute\",\"Tolliver\",\"Dimitriou\",\"2%\",\"2 points\"]}",
 "verified": false,
 "via": "live"
}
