{
 "$schema": "model_cache.schema.json",
 "json": {
  "alternatives": [
   {
    "actor": "p_047",
    "kind": "pass",
    "reason": "Bastian Sandoval is centrally placed and offers the highest threat to progress the attack.",
    "target": "p_046"
   },
   {
    "actor": "p_047",
    "kind": "carry",
    "reason": "Drive into space down the flank to draw defenders and open up central passing lanes.",
    "target": "e"
   },
   {
    "actor": "p_045",
    "kind": "pass",
    "reason": "Switch play across to Fintan Grabowski to stretch the defensive shape and exploit the far side.",
    "target": "p_045"
   }
  ]
 },
 "record": "model_result",
 "round": 1,
 "schema_version": "1.0.0",
 "text": "{\"alternatives\": [{\"kind\": \"pass\", \"actor\": \"p_047\", \"target\": \"p_046\", \"reason\": \"Bastian Sandoval is centrally placed and offers the highest threat to progress the attack.\"}, {\"kind\": \"carry\", \"actor\": \"p_047\", \"target\": \"e\", \"reason\": \"Drive into space down the flank to draw defenders and open up central passing lanes.\"}, {\"kind\": \"pass\", \"actor\": \"p_045\", \"target\": \"p_045\", \"reason\": \"Switch play across to Fintan Grabowski to stretch the defensive shape and exploit the far side.\"}]}",
 "verified": null,
 "via": "live"
}
