{
 "$schema": "model_cache.schema.json",
 "json": {
  "claims": [
   {
    "evidence_ids": [
     "pc_046163"
    ],
    "kind": "number",
    "text": "74%",
    "unit": "percent",
    "value_number": 0.7402
   },
   {
    "evidence_ids": [
     "pc_046163"
    ],
    "kind": "tactical",
    "text": "3v1 in the central middle third",
    "unit": "",
    "value_text": "overload_centre_middle_third"
   },
   {
    "evidence_ids": [
     "cf_000070"
    ],
    "kind": "number",
    "text": "10%",
    "unit": "p_goal",
    "value_number": 0.1045
   },
   {
    "evidence_ids": [
     "cf_000070"
    ],
    "kind": "number",
    "text": "+4 points",
    "unit": "win_prob_delta",
    "value_number": 0.0374
   }
  ],
  "stance": "agree",
  "take": "It is not just about the counter-press; the structure is already built with 74% overall pitch control and a 3v1 in the central middle third dictating the tempo. Rushing the shot throws away that territorial foundation when the extra pass lifts the goal probability to 10% and adds +4 points to the win chance."
 },
 "record": "model_result",
 "round": 3,
 "schema_version": "1.0.0",
 "text": "{\"take\": \"It is not just about the counter-press; the structure is already built with 74% overall pitch control and a 3v1 in the central middle third dictating the tempo. Rushing the shot throws away that territorial foundation when the extra pass lifts the goal probability to 10% and adds +4 points to the win chance.\", \"stance\": \"agree\", \"claims\": [{\"text\": \"74%\", \"kind\": \"number\", \"value_number\": 0.7402, \"unit\": \"percent\", \"evidence_ids\": [\"pc_046163\"]}, {\"text\": \"3v1 in the central middle third\", \"kind\": \"tactical\", \"value_text\": \"overload_centre_middle_third\", \"unit\": \"\", \"evidence_ids\": [\"pc_046163\"]}, {\"text\": \"10%\", \"kind\": \"number\", \"value_number\": 0.1045, \"unit\": \"p_goal\", \"evidence_ids\": [\"cf_000070\"]}, {\"text\": \"+4 points\", \"kind\": \"number\", \"value_number\": 0.0374, \"unit\": \"win_prob_delta\", \"evidence_ids\": [\"cf_000070\"]}]}",
 "verified": null,
 "via": "live"
}
