{
 "$schema": "model_cache.schema.json",
 "json": {
  "body": "Pundits analyze whether playing an alternative pass is a viable way to navigate the away press. The model rates the option at 41%.",
  "claims": [
   "41%"
  ],
  "headline": "Debating an Alternative Pass Against the Press"
 },
 "record": "model_result",
 "round": 6,
 "schema_version": "1.0.0",
 "text": "{\"headline\": \"Debating an Alternative Pass Against the Press\", \"body\": \"Pundits analyze whether playing an alternative pass is a viable way to navigate the away press. The model rates the option at 41%.\", \"claims\": [\"41%\"]}",
 "verified": true,
 "via": "live"
}
