{
 "$schema": "model_cache.schema.json",
 "json": {
  "claims": [],
  "stance": "disagree",
  "take": "Tobi Okafor strikes immediately before the defense can settle, proving why ruthless speed in transition is the ultimate weapon in this match. Hesitating for an extra pass only lets the opposition reorganize, so firing right away is the exact right call."
 },
 "record": "model_result",
 "round": 3,
 "schema_version": "1.0.0",
 "text": "{\n  \"take\": \"Tobi Okafor strikes immediately before the defense can settle, proving why ruthless speed in transition is the ultimate weapon in this match. Hesitating for an extra pass only lets the opposition reorganize, so firing right away is the exact right call.\",\n  \"stance\": \"disagree\",\n  \"claims\": []\n}",
 "verified": null,
 "via": "live"
}
