{
 "$schema": "model_cache.schema.json",
 "json": {
  "claims": [
   {
    "evidence_ids": [
     "e_0026",
     "e_0028"
    ],
    "kind": "player",
    "text": "Jasper Cavendale",
    "unit": "",
    "value_text": "p_012"
   },
   {
    "evidence_ids": [
     "e_0027",
     "cf_000002"
    ],
    "kind": "player",
    "text": "Bastian Sandoval",
    "unit": "",
    "value_text": "p_046"
   },
   {
    "evidence_ids": [
     "e_0027",
     "cf_000002"
    ],
    "kind": "player",
    "text": "Kaito Marchetti",
    "unit": "",
    "value_text": "p_039"
   },
   {
    "evidence_ids": [
     "pc_000488"
    ],
    "kind": "number",
    "text": "68%",
    "unit": "percent",
    "value_number": 0.6772
   },
   {
    "evidence_ids": [
     "cf_000002"
    ],
    "kind": "player",
    "text": "Tarik Varga",
    "unit": "",
    "value_text": "p_047"
   },
   {
    "evidence_ids": [
     "cf_000002"
    ],
    "kind": "number",
    "text": "12%",
    "unit": "percent",
    "value_number": 0.1165
   }
  ],
  "confidence": 0.88,
  "why": "Under pressure from Jasper Cavendale, Bastian Sandoval forces a pass to Kaito Marchetti into a midfield where Verdant Athletic hold 68% pitch control, leading to an interception. Switching the play to Tarik Varga instead is a 12% option that more than doubles the expected threat gain from 0.004 xT to 0.008 xT."
 },
 "record": "model_result",
 "round": 2,
 "schema_version": "1.0.0",
 "text": "{\"why\":\"Under pressure from Jasper Cavendale, Bastian Sandoval forces a pass to Kaito Marchetti into a midfield where Verdant Athletic hold 68% pitch control, leading to an interception. Switching the play to Tarik Varga instead is a 12% option that more than doubles the expected threat gain from 0.004 xT to 0.008 xT.\",\"confidence\":0.88,\"claims\":[{\"text\":\"Jasper Cavendale\",\"kind\":\"player\",\"value_text\":\"p_012\",\"unit\":\"\",\"evidence_ids\":[\"e_0026\",\"e_0028\"]},{\"text\":\"Bastian Sandoval\",\"kind\":\"player\",\"value_text\":\"p_046\",\"unit\":\"\",\"evidence_ids\":[\"e_0027\",\"cf_000002\"]},{\"text\":\"Kaito Marchetti\",\"kind\":\"player\",\"value_text\":\"p_039\",\"unit\":\"\",\"evidence_ids\":[\"e_0027\",\"cf_000002\"]},{\"text\":\"68%\",\"kind\":\"number\",\"value_number\":0.6772,\"unit\":\"percent\",\"evidence_ids\":[\"pc_000488\"]},{\"text\":\"Tarik Varga\",\"kind\":\"player\",\"value_text\":\"p_047\",\"unit\":\"\",\"evidence_ids\":[\"cf_000002\"]},{\"text\":\"12%\",\"kind\":\"number\",\"value_number\":0.1165,\"unit\":\"percent\",\"evidence_ids\":[\"cf_000002\"]}]}",
 "verified": false,
 "via": "live"
}
