{
 "$schema": "model_cache.schema.json",
 "json": {
  "claims": [],
  "stance": "nuance",
  "take": "Transition speed is alluring, yet structure dictates that when you occupy that advanced territory, maintaining control and circulating the ball to an open teammate creates a far safer, more repeatable scoring lane than forcing an early shot."
 },
 "record": "model_result",
 "round": 4,
 "schema_version": "1.0.0",
 "text": "{\"take\": \"Transition speed is alluring, yet structure dictates that when you occupy that advanced territory, maintaining control and circulating the ball to an open teammate creates a far safer, more repeatable scoring lane than forcing an early shot.\", \"stance\": \"nuance\", \"claims\": []}",
 "verified": null,
 "via": "live"
}
