{
 "$schema": "model_cache.schema.json",
 "json": {
  "consensus": "All pundits recognize that Tobi Okafor fired immediately off the turnover in transition rather than recycling the attack.",
  "dissent": "The sharpest disagreement is over whether Tobi Okafor was justified in shooting immediately or should have recycled possession to establish attacking shape.",
  "headline": "Okafor Shot Debate"
 },
 "record": "model_result",
 "round": 5,
 "schema_version": "1.0.0",
 "text": "{\"consensus\":\"All pundits recognize that Tobi Okafor fired immediately off the turnover in transition rather than recycling the attack.\",\"dissent\":\"The sharpest disagreement is over whether Tobi Okafor was justified in shooting immediately or should have recycled possession to establish attacking shape.\",\"headline\":\"Okafor Shot Debate\"}",
 "verified": null,
 "via": "live"
}
